{
  "task_id": "task-003",
  "project_id": "refund-retries",
  "title": "Review",
  "goal": "Verify both tasks.",
  "assigned_to": "reviewer_agent",
  "scope": {
    "in": [],
    "out": []
  },
  "acceptance_criteria": [
    "Every acceptance criterion passes"
  ],
  "status": "pending",
  "dependencies": [
    "task-002"
  ],
  "created_at": "2026-10-20T10:00:00Z",
  "updated_at": "2026-10-20T10:00:00Z"
}
