{
  "task_id": "task-002",
  "project_id": "account-scope-hotfix",
  "title": "Review the hotfix",
  "goal": "Verify the allowlist and the test.",
  "assigned_to": "reviewer_agent",
  "scope": {
    "in": [],
    "out": []
  },
  "acceptance_criteria": [
    "Every acceptance criterion passes"
  ],
  "status": "done",
  "dependencies": [
    "task-fix-001"
  ],
  "created_at": "2026-10-06T10:00:00Z",
  "updated_at": "2026-10-06T10:00:00Z"
}
