{
  "task_id": "task-002",
  "project_id": "refund-retries",
  "title": "Refund status on the invoice page",
  "goal": "Show refund status and attempts.",
  "assigned_to": "web_agent",
  "scope": {
    "in": [],
    "out": []
  },
  "acceptance_criteria": [
    "Shows pending, retrying, succeeded or failed",
    "Failed refunds explain what to do next"
  ],
  "status": "pending",
  "dependencies": [
    "task-001"
  ],
  "created_at": "2026-10-20T10:00:00Z",
  "updated_at": "2026-10-20T10:00:00Z"
}
